{
  "schema_version": "stack-manager-decision.v1",
  "phase": "emission",
  "operation": "link",
  "selected_manager": "gh-stack",
  "reason": "gh-stack 0.0.5 is installed, its read-only link contract accepts existing PR numbers in bottom-to-top order, and the current 18 local branch refs form the exact protected linear marker topology. Existing packet-owned PRs remain authoritative; gh-stack is limited to stack linking.",
  "fallback_reason": null,
  "fallback_allowed": true,
  "mutation_boundary": {
    "status": "planned",
    "first_mutating_command_id": "link-existing-stack-by-pr-number",
    "fallback_after_boundary_allowed": true
  },
  "gh_stack": {
    "available": true,
    "supported": true,
    "reason": "gh stack version 0.0.5 and gh stack link --help both exit zero; link supports existing PR numbers, --base, and --open.",
    "extension_owner": "github",
    "extension_name": "gh-stack",
    "version": "0.0.5",
    "version_supported": true,
    "repo_enabled": true,
    "support_status": "supported",
    "invocation": [
      [
        "gh",
        "stack",
        "--version"
      ],
      [
        "gh",
        "stack",
        "link",
        "--help"
      ]
    ]
  },
  "read_only_proof": {
    "argv": [
      "gh",
      "stack",
      "link",
      "--help"
    ],
    "exit_status": 0,
    "parsed": true,
    "matched_expected_topology": true,
    "stdout_tail": "gh-stack 0.0.5 accepts existing PR numbers in bottom-to-top order; local ancestry proof matched all 18 current branch refs with zero merge commits.",
    "stderr_tail": "",
    "evidence_path": "specs/xplat-010-repository-bash-confinement/.process/emission/stack-manager-decision.json"
  },
  "topology_compatibility": {
    "compatible": true,
    "source": "combined",
    "mismatch_reason": null,
    "expected_order": [
      "00-process",
      "01-foundation",
      "02-us14",
      "03-us1",
      "04-us2",
      "05-us3",
      "06-us4",
      "07-us5",
      "08-us6",
      "09-us7",
      "10-us7b",
      "11-us8",
      "12-us9",
      "13-us10",
      "14-us11",
      "15-release-contract",
      "16-release-composition",
      "17-polish"
    ],
    "observed_order": [
      "00-process",
      "01-foundation",
      "02-us14",
      "03-us1",
      "04-us2",
      "05-us3",
      "06-us4",
      "07-us5",
      "08-us6",
      "09-us7",
      "10-us7b",
      "11-us8",
      "12-us9",
      "13-us10",
      "14-us11",
      "15-release-contract",
      "16-release-composition",
      "17-polish"
    ]
  },
  "command_plan": [
    {
      "id": "link-existing-stack-by-pr-number",
      "action": "link_stack",
      "manager": "gh-stack",
      "argv": [
        "gh",
        "stack",
        "link",
        "--base",
        "main",
        "--open",
        "311",
        "312",
        "313",
        "314",
        "315",
        "316",
        "317",
        "318",
        "319",
        "320",
        "321",
        "322",
        "323",
        "324",
        "325",
        "326",
        "327",
        "328"
      ],
      "mutates": true,
      "mutation_boundary": true,
      "slice_id": null,
      "review_order": null,
      "preconditions": [
        "all-18-prs-open-with-exact-base-head",
        "gh-stack-version-0.0.5-supported",
        "read-only-local-topology-proof-matched"
      ],
      "reason": "Reconcile the already-created PR numbers bottom-to-top without synthesizing or replacing packet-owned titles or bodies."
    }
  ],
  "topology": {
    "pre_mutation": [
      {
        "review_order": 1,
        "slice_id": "00-process",
        "branch": "xplat-010-review/00-process",
        "base_branch": "main",
        "pr_number": 311,
        "pr_url": "https://github.com/racecraft-lab/racecraft-plugins-public/pull/311",
        "head_sha": "da15f705d92973bf741e9728cf68e24e3a91807c",
        "status": "existing_pr_record_and_local_ref_matched"
      },
      {
        "review_order": 2,
        "slice_id": "01-foundation",
        "branch": "xplat-010-review/01-foundation",
        "base_branch": "xplat-010-review/00-process",
        "pr_number": 312,
        "pr_url": "https://github.com/racecraft-lab/racecraft-plugins-public/pull/312",
        "head_sha": "1304d5a1fdbee4329d16385369a535bc2fc7a448",
        "status": "existing_pr_record_and_local_ref_matched"
      },
      {
        "review_order": 3,
        "slice_id": "02-us14",
        "branch": "xplat-010-review/02-us14",
        "base_branch": "xplat-010-review/01-foundation",
        "pr_number": 313,
        "pr_url": "https://github.com/racecraft-lab/racecraft-plugins-public/pull/313",
        "head_sha": "c2d3b0c7bde975c1d7f864ce43256c60e00e44d2",
        "status": "existing_pr_record_and_local_ref_matched"
      },
      {
        "review_order": 4,
        "slice_id": "03-us1",
        "branch": "xplat-010-review/03-us1",
        "base_branch": "xplat-010-review/02-us14",
        "pr_number": 314,
        "pr_url": "https://github.com/racecraft-lab/racecraft-plugins-public/pull/314",
        "head_sha": "9f9684fa6fa48d70dc0053f96e2b253435ecdf57",
        "status": "existing_pr_record_and_local_ref_matched"
      },
      {
        "review_order": 5,
        "slice_id": "04-us2",
        "branch": "xplat-010-review/04-us2",
        "base_branch": "xplat-010-review/03-us1",
        "pr_number": 315,
        "pr_url": "https://github.com/racecraft-lab/racecraft-plugins-public/pull/315",
        "head_sha": "7d6a6d115b6832e3f61e7e25701292679b9079d3",
        "status": "existing_pr_record_and_local_ref_matched"
      },
      {
        "review_order": 6,
        "slice_id": "05-us3",
        "branch": "xplat-010-review/05-us3",
        "base_branch": "xplat-010-review/04-us2",
        "pr_number": 316,
        "pr_url": "https://github.com/racecraft-lab/racecraft-plugins-public/pull/316",
        "head_sha": "9b249ddd0ed0b8518006cfd404141142f7507018",
        "status": "existing_pr_record_and_local_ref_matched"
      },
      {
        "review_order": 7,
        "slice_id": "06-us4",
        "branch": "xplat-010-review/06-us4",
        "base_branch": "xplat-010-review/05-us3",
        "pr_number": 317,
        "pr_url": "https://github.com/racecraft-lab/racecraft-plugins-public/pull/317",
        "head_sha": "cf352fbc355b30245baaf6b013166066ac4401ad",
        "status": "existing_pr_record_and_local_ref_matched"
      },
      {
        "review_order": 8,
        "slice_id": "07-us5",
        "branch": "xplat-010-review/07-us5",
        "base_branch": "xplat-010-review/06-us4",
        "pr_number": 318,
        "pr_url": "https://github.com/racecraft-lab/racecraft-plugins-public/pull/318",
        "head_sha": "c1d5e51c8ade2284629092309894b1a4a8fdb10c",
        "status": "existing_pr_record_and_local_ref_matched"
      },
      {
        "review_order": 9,
        "slice_id": "08-us6",
        "branch": "xplat-010-review/08-us6",
        "base_branch": "xplat-010-review/07-us5",
        "pr_number": 319,
        "pr_url": "https://github.com/racecraft-lab/racecraft-plugins-public/pull/319",
        "head_sha": "790b9e230de1381fda2010a22480e8594ac6628a",
        "status": "existing_pr_record_and_local_ref_matched"
      },
      {
        "review_order": 10,
        "slice_id": "09-us7",
        "branch": "xplat-010-review/09-us7",
        "base_branch": "xplat-010-review/08-us6",
        "pr_number": 320,
        "pr_url": "https://github.com/racecraft-lab/racecraft-plugins-public/pull/320",
        "head_sha": "7584c468cbef81d60fe8bc2b911df0359c7ea243",
        "status": "existing_pr_record_and_local_ref_matched"
      },
      {
        "review_order": 11,
        "slice_id": "10-us7b",
        "branch": "xplat-010-review/10-us7b",
        "base_branch": "xplat-010-review/09-us7",
        "pr_number": 321,
        "pr_url": "https://github.com/racecraft-lab/racecraft-plugins-public/pull/321",
        "head_sha": "511746913f0c9bc99bd1a3245d473a029662af73",
        "status": "existing_pr_record_and_local_ref_matched"
      },
      {
        "review_order": 12,
        "slice_id": "11-us8",
        "branch": "xplat-010-review/11-us8",
        "base_branch": "xplat-010-review/10-us7b",
        "pr_number": 322,
        "pr_url": "https://github.com/racecraft-lab/racecraft-plugins-public/pull/322",
        "head_sha": "15fac7807df11f4d8b49f9b15bbde17d304b17bf",
        "status": "existing_pr_record_and_local_ref_matched"
      },
      {
        "review_order": 13,
        "slice_id": "12-us9",
        "branch": "xplat-010-review/12-us9",
        "base_branch": "xplat-010-review/11-us8",
        "pr_number": 323,
        "pr_url": "https://github.com/racecraft-lab/racecraft-plugins-public/pull/323",
        "head_sha": "3348aa4fbb80373b39fedbd18003c63f5c33862d",
        "status": "existing_pr_record_and_local_ref_matched"
      },
      {
        "review_order": 14,
        "slice_id": "13-us10",
        "branch": "xplat-010-review/13-us10",
        "base_branch": "xplat-010-review/12-us9",
        "pr_number": 324,
        "pr_url": "https://github.com/racecraft-lab/racecraft-plugins-public/pull/324",
        "head_sha": "93aaddd09d04a89b60bdc0085073a732b95e705c",
        "status": "existing_pr_record_and_local_ref_matched"
      },
      {
        "review_order": 15,
        "slice_id": "14-us11",
        "branch": "xplat-010-review/14-us11",
        "base_branch": "xplat-010-review/13-us10",
        "pr_number": 325,
        "pr_url": "https://github.com/racecraft-lab/racecraft-plugins-public/pull/325",
        "head_sha": "c6b47a6d8587f4a1b841f3d52bc8ba933794ac98",
        "status": "existing_pr_record_and_local_ref_matched"
      },
      {
        "review_order": 16,
        "slice_id": "15-release-contract",
        "branch": "xplat-010-review/15-release-contract",
        "base_branch": "xplat-010-review/14-us11",
        "pr_number": 326,
        "pr_url": "https://github.com/racecraft-lab/racecraft-plugins-public/pull/326",